id,code,loc,floor,cate,space,franch,date,hits,title,marks,subtitle,copy,deposit,mthfee,prem,nego_ok,regist
541249,55-3437,인천시 연수구 송도동,4층,레스토랑,761.45m²,마루샤브,2021-07-01,333,이매물이 최고죠! 송도 마루샤브 매매합니다,"프랜차이즈, 현장사진",송도중심상업지역 골든블록내 최고의 입지조건!,이매물이 최고죠! 송도 마루샤브 매매합니다,"7,000만",655만,"4억5,000만",협상가능,중개거래
541355,55-3543,경기북부 남양주시 다산동,2층,레스토랑,79.34m²,정씨함박,2021-06-30,836,다산 초중심상권 프랜차이즈 정씨함박,"프랜차이즈, 연락처공개, 주소공개, 현장동영상, 현장사진","입지, 상권, 유동인구 등 직접 확인하세요","수제함박 패티와 모든 소스를 매일 아침 신선한 재료로 직접 만드는 정씨함박

","4,000만",240만,"9,500만",협상가능,직거래
540218,55-2409,서울시 서대문구 홍제동,1층,레스토랑,66.12m²,,2021-06-30,438,세상에 이런 돈까스매장은 없었다!!,"연락처공개, 주소공개, 현장동영상, 현장사진",홍제역 인스타 맛집!! 랭킹 1위~~~,월 평균 매출 3000만원 초중반 / 월 순이익 1150만원 투명하게 매출 공개 가능합니다. 직접 확인하세요.,"1,500만",120만,"8,500만",협상가능,직거래
539658,55-1854,경기남부 김포시 장기동,2층,레스토랑,234.49m²,서가앤쿡,2021-06-30,328,((서가앤쿡)) 풀오토매장! 순수익 굿!,"프랜차이즈, 현장동영상, 현장사진",관리만 좀 하시고  안정적으로  수익 가져가세요,"풀오토로도 순수익   쏠쏠!
직접 운영시 매출과  수익은  껑충!!
빠르게 문의주세요  !!!","1억2,500만",630만,"2억7,000만",협상가능,중개거래
541598,55-3786,경기남부 화성시 반송동,1층,레스토랑,264.46m²,서가앤쿡,2021-06-30,226,{초특급/초저가}서가앤쿡 동탄점 매매!!!,"프랜차이즈, 연락처공개, 주소공개, 현장동영상, 현장사진",[월 순수익 1천만원]권리금 5천만원에 나왔습니다!!,"최고 항아리 상권인 동탄 파라곤 주상복합단지 1층 상가내에 입점해 동탄신도시에서 맛집으로 유명하며, 확실한 ...",1억,718만,"5,000만",협상가능,직거래
538172,55-0369,서울시 영등포구 문래동2가,1층,레스토랑,332m²,,2021-04-14,437,문래동 창작촌 방송출현 맛집1층 레스토랑,"연락처공개, 현장동영상, 현장사진",방송출현 맛집 레스토랑 / 기본매출5천만원 / 인기몰이 최상,문래동 기본매출 5천 현재 핫플레이스 방송출현 인기몰이 1층 레스토랑,"3,000만",355만,3억,협상가능,직거래
545022,55-7203,경기남부 성남시 분당구 구미동,1층,레스토랑,36.36m²,,2021-07-08,11,미금역바로앞 모두 인정한 맛집 [낭만파스타],"연락처공개, 주소공개, 현장동영상, 현장사진",2001아울렛 바로옆!! 엠코헤리츠 1층~최고위치!,잘부탁드립니다,"3,000만",280만,"5,000만",협상가능,직거래
516174,52-8415,서울시 강서구 내발산동,2층,레스토랑,231.41m²,올리앤(Ollie...,2021-07-06,2386,((반값))상승세인 매출로 수익뿜뿜,"프랜차이즈, 연락처공개, 주소공개, 현장동영상, 현장사진",임대료 한시적20퍼센트  인하!!,"초초초초특급 프랜차이즈레스토랑
어서  와보세요","7,000만",300만,"7,000만",협상가능,직거래
535458,54-7682,서울시 성동구 행당동,-1층,레스토랑,85.93m²,,2021-07-06,518,왕십리역6번출구 한양대 메인상권 레스토랑,"연락처공개, 주소공개, 현장사진",한양대 메인상권 sns유명 파스타 매장,한양대6번출구앞 왕십리 유명 파스타 전문매장. 인스타 맛집 보장!!,"2,000만",120만,"6,000만",협상가능,직거래
534648,54-6875,경기남부 시흥시 은행동,2층,레스토랑,115.7m²,빈체로,2021-07-06,1087,[급매]시흥은계지구 파스타점-인테리어설비A급,"프랜차이즈, 연락처공개, 주소공개, 현장동영상, 현장사진",타업종도 가능 / 권리 얼마면 인수가능 하실까요?,"상권,입지 좋은 우량 프랜차이즈 파스타 피자 전문점입니다.","5,000만",300만,"6,000만",협상가능,직거래
533954,54-6182,충청남도 홍성군 홍북읍 신경리,1층,레스토랑,115.7m²,,2021-07-06,527,[홍성] 추천!연매출 7억이상 레스토랑!!,"연락처공개, 주소공개, 현장동영상, 현장사진",줄서서먹는 맛집! 순익 한달 2000 이상 !!! 문의주세요,"교환절대사절, 매장관련문의는 환영합니다!","1,000만",130만,"2억3,000만",협상가능,직거래
524195,53-6433,경기남부 안산시 상록구 사동,1층,레스토랑,231.41m²,부엉이돈가스,2021-07-06,1032,섹시한 레스토랑,"프랜차이즈, 연락처공개, 주소공개, 현장동영상, 현장사진",섹시한 상권 접근성 컨디션 도로접 넓은주차장,섹시한 레스토랑,"3,000만",300만,"1억1,000만",협상가능,직거래
516922,52-9163,인천시 중구 운남동,1층,레스토랑,396.7m²,,2021-07-06,456,영종도 하늘도시 기가막힌 풍경의 인테리어!!,"연락처공개, 주소공개, 현장사진",럭셔리한 영종도 독점 패밀리 레스토랑이 드뎌 나왔어요~!!,영종도 독점 패밀리 레스토랑입니다.안정적인매출과 깔끔하고 고급스러운 럭셔리함은 눈으로 보셔야 백프로 느끼세요...,1억,420만,"2억2,000만",협상가능,직거래
514699,52-6941,서울시 용산구 한강로2가,-2층,레스토랑,64.46m²,,2021-07-06,658,"[용산]합금 5천, 줄서서먹는 상권","연락처공개, 주소공개, 현장사진",점심에 만석/ 알짜매장 싸게 던집니다,특A급 시설을 그대로 살려서 바로 운영이 가능합니다.,"3,000만",240만,없음,,직거래
536956,54-9159,경기남부 평택시 비전동,2층,레스토랑,100.8m²,도쿄스테이크,2021-07-06,627,[평택] 프랜차이즈 스테이크 맛집!!,"프랜차이즈, 연락처공개, 주소공개, 현장동영상, 현장사진",월수익 800!! 품격있고 깔끔하게 돈벌기!,교환문의는 사절!! 협상문의는 OK!!,"3,000만",179만,"6,000만",협상가능,직거래
536608,54-8811,경기남부 수원시 영통구 매탄동,2층,레스토랑,92.56m²,,2021-07-06,410,[수원] 삼성단지 중심에 위치한 레스토랑,"연락처공개, 주소공개, 현장사진","인테리어 잡지에도 나온 최상급 매장, 특A급 입지",교환문의 절대 사절. 강경대응 합니다.,"3,000만",200만,1억,협상가능,직거래
532557,54-4786,경기북부 동두천시 송내동,2층,레스토랑,247m²,,2021-07-06,572,최상급 시설로 부수입까지 발생하는 레스토랑,"연락처공개, 현장사진",옥상 풀살장과 트램플린 시설로 짭짤한 부수입까지!,교환문의 절대 사절!!,"3,000만",200만,"3,000만",협상가능,직거래
526545,53-8782,서울시 강서구 마곡동,2층,레스토랑,58.84m²,,2021-07-06,495,((발산역))가장 핫한 마곡동 상권!!!,"연락처공개, 주소공개, 현장동영상, 현장사진",정말  작정하고 모이는 먹자!!  놀자촌 !,마곡 스테이크맛집 강추합니다!!,"4,000만",280만,1억,협상가능,직거래
542266,55-4453,서울시 동대문구 회기동,1층,레스토랑,163.76m²,,2021-07-06,189,경희대 최고급 명품 인테리어 점포라인 추천!,"연락처공개, 주소공개, 현장동영상, 현장사진",시설대비 입지대비 최저 권리금!,010-7516-2211,"1억1,000만",400만,"3,500만",협상가능,직거래
538155,55-0352,서울시 영등포구 문래동3가,1층,레스토랑,135m²,,2021-07-06,260,문래역 로데오거리 메인1층 레스토랑,"연락처공개, 주소공개, 현장동영상, 현장사진","기본매출 3천이상 / 아파트 2,959세대 / 방송출현 인기몰이",문래역 로데오거리 및 인기몰이 1층 레스토랑,"2,500만",245만,2억,협상가능,직거래
545026,55-7207,경기북부 고양시 덕양구 향동동,1층,레스토랑,39.67m²,,2021-07-09,3,고양시 향동신도시 점포 매도,"연락처공개, 주소공개, 현장동영상, 현장사진",위치 좋습니다 연락주세요,,"4,000만",240만,"6,500만",협상가능,직거래
544965,55-7146,서울시 서대문구 연희동,2층,레스토랑,99.17m²,,2021-07-08,3,연희동 브런치카페,"연락처공개, 주소공개, 현장동영상, 현장사진",부동산 교환 권유 전화 엄금!,,"2,000만",180만,"1,500만",협상가능,직거래
544629,55-6810,서울시 송파구 송파동,1층,레스토랑,66.12m²,,2021-07-05,9,송파구 밀집주거지역 시설상태 완벽한 피맥맛집,"연락처공개, 주소공개, 현장사진",송파구 밀집주거지역 시설상태 완벽한 피맥 맛집입니다.,,"5,000만",320만,"9,000만",협상가능,직거래
544585,55-6766,서울시 송파구 방이동,1층,레스토랑,66m²,,2021-07-02,17,((방이동)) 매출좋은 레스토랑,"연락처공개, 주소공개, 현장사진",분위기 좋고  매출 좋아서  입소문난  맛집,,"5,000만",330만,1억,협상가능,직거래
544567,55-6748,경기북부 동두천시 지행동,1층,레스토랑,99.17m²,,2021-07-05,10,퀄리티 높은 동두천시 돈까스 최고맛집 임대,"연락처공개, 주소공개, 현장사진",계약하실분만 연락주시기 바랍니다,,"3,000만",300만,"2억2,000만",협상가능,직거래
544405,55-6587,서울시 마포구 상수동,-1층,레스토랑,64m²,,2021-07-01,20,홍익대학교 앞 레스토랑,"연락처공개, 주소공개, 현장사진",[교환사절] 문자로 먼저 상담 문의 주세요,,"3,000만",170만,"1,000만",협상가능,직거래
543424,55-5609,경기남부 시흥시 대야동,1층,레스토랑,99.17m²,,2021-06-16,22,시흥시 선식당 은계점 매도합니다,"연락처공개, 주소공개, 현장동영상, 현장사진",일평균 90만 이상 매출,,"2,000만",120만,"6,500만",협상가능,직거래
542201,55-4388,경기북부 고양시 일산동구 장항동,1층,레스토랑,34.05m²,,2021-06-28,70,일산동구 장항동 파스타집 인수하실분,"연락처공개, 주소공개, 현장사진","작년에는 월 2,400~3,100만원까지 매출을 올렸습니다.",,"3,000만",200만,"2,500만",협상가능,직거래
541904,55-4092,서울시 서초구 방배동,1층,레스토랑,39.67m²,,2021-06-24,57,방배 고급진 분위기 레스토랑,"연락처공개, 주소공개, 현장동영상, 현장사진",동네도 고퀄 가게도 고퀄 음식도 고퀄..,,"5,000만",185만,"3,000만",협상가능,직거래
541216,55-3405,서울시 종로구 익선동,1층,레스토랑,85.95m²,,2021-06-14,89,종로구 익선동 독채한옥 식당,"연락처공개, 주소공개, 현장동영상, 현장사진",부동산 교환권유 전화 금지!,,"2,000만",200만,"8,500만",협상가능,직거래
540091,55-2282,경기남부 용인시 처인구 김량장동,1층,레스토랑,36.36m²,,2021-06-08,41,용인 처인구 유명 스파게티 프랜차이즈,"연락처공개, 주소공개, 현장동영상, 현장사진","각종 오피스, 병원 밀집 지역 좋은 입지",,"1,000만",120만,"6,000만",협상가능,직거래
539027,55-1223,경기남부 안산시 단원구 고잔동,1층,레스토랑,28.1m²,,2021-06-28,57,안산 고잔동 로데오 먹자거리 멕시칸요리점,"연락처공개, 주소공개, 현장동영상, 현장사진",안산에서 가장 활성화 되어있는 먹자상권에 위치,,"1,000만",78만,"2,000만",협상가능,직거래
538600,55-0796,서울시 종로구 사직동,1층,레스토랑,62.81m²,,2021-04-20,98,종로구 한옥 레스토랑,"연락처공개, 주소공개, 현장동영상, 현장사진",부동산 교환문의 절대사절,,"3,000만",200만,"7,500만",협상가능,직거래
538527,55-0723,서울시 중구 남산동2가,1층,레스토랑,218.18m²,,2021-06-22,55,명동 상권 비스트로,"연락처공개, 주소공개, 현장사진",[교환사절] 문자로 먼저 상담 문의 주세요,,"8,000만",800만,2억,협상가능,직거래
538363,55-0559,서울시 동작구 상도동,1층,레스토랑,42.42m²,,2021-04-16,90,동작구 프랜차이즈 레스토랑,"연락처공개, 주소공개, 현장사진",부동산 교환문의 절대사절,,"1,000만",85만,"2,500만",협상가능,직거래
538184,55-0381,서울시 관악구 봉천동,2층,레스토랑,85.95m²,올더플레이트(AL...,2021-06-17,164,[관악] 샤로수길 올더플레이트,"프랜차이즈, 연락처공개, 주소공개, 현장사진",>>맞교환 사절! 맞교환권유업체 전화금지<<,,"2,000만",230만,"6,000만",협상가능,직거래
537771,54-9971,경기남부 부천시 괴안동,1층,레스토랑,59.5m²,,2021-04-08,50,[경기남부 부천시] 피자전문점!!,"연락처공개, 주소공개, 현장사진",안정적인 매출!,,"2,000만",130만,"5,000만",협상가능,직거래
537728,54-9928,인천시 부평구 부평동,2층,레스토랑,175.43m²,,2021-04-08,51,인천 부평구 부평동 레스토랑,"연락처공개, 주소공개, 현장동영상, 현장사진",부동산 교환권유 전화금지!,,"3,000만",200만,"1억8,000만",협상가능,직거래
537643,54-9843,서울시 마포구 동교동,2층,레스토랑,92.56m²,,2021-06-14,48,홍대입구역 레스토랑,"연락처공개, 주소공개, 현장사진",[교환사절] 문자로 먼저 상담 문의 주세요,,"2,000만",250만,1억,협상가능,직거래
537537,54-9737,경기북부 양주시 고암동,2층,레스토랑,247.94m²,,2021-04-06,68,양주 덕정 이탈리안 레스토랑 매장 양도,"연락처공개, 주소공개, 현장동영상, 현장사진",경기북부 양주시 고암동에 위치한 이탈리안 레스토랑 매장,,"5,000만",300만,"1억5,000만",협상가능,직거래
537339,54-9541,경기남부 시흥시 정왕동,1층,레스토랑,49.59m²,,2021-06-03,63,배곧신도시 호반써밋플레이스 파스타매장,"연락처공개, 주소공개, 현장사진",상권 메인 주상복합 1층 상가에 위치한 시설 좋은 레스토랑.,,"5,000만",250만,"7,000만",협상가능,직거래
537220,54-9422,서울시 서초구 반포동,1층,레스토랑,66.12m²,,2021-06-07,108,서초구 반포동 서래마을 고급 양식 레스토랑,"연락처공개, 주소공개, 현장사진",최상급인테리어 좋은 분위기 깔끔한 매장 리뷰맛집 / 교환업자 사절,,"5,000만",270만,"1억5,500만",협상가능,직거래
535499,54-7723,경기남부 화성시 향남읍 하길리,3층,레스토랑,175.21m²,,2021-06-07,60,향남 2지구 프랜차이즈 레스토랑,"연락처공개, 주소공개, 현장동영상, 현장사진",교환업자 전화 신고 대응합니다...,,"6,000만",320만,"5,500만",협상가능,직거래
534180,54-6407,경기남부 화성시 송동,-2층,레스토랑,119m²,,2021-06-10,110,동탄 호수공원 레이크꼬모 특급 레스토랑,"연락처공개, 주소공개, 현장사진",부동산문의 교환및문의절대사절입니다!!,,"5,000만",400만,"2억4,000만",협상가능,직거래
533929,54-6157,서울시 서대문구 홍은동,1층,레스토랑,62.81m²,,2021-06-14,78,명지대학교 앞 레스토랑,"연락처공개, 주소공개, 현장동영상, 현장사진",문자로 먼저 상담 문의 주세요,,"3,000만",150만,"7,500만",협상가능,직거래
533655,54-5883,경기남부 안성시 당왕동,2층,레스토랑,162m²,,2021-07-05,58,인테리어 상태 최상급! 인지도 높은 매장,"연락처공개, 주소공개, 현장사진",부동산문의 교환및문의 절대사절입니다.,,"3,000만",200만,"1억4,000만",협상가능,직거래
533523,54-5751,경기남부 수원시 영통구 매탄동,2층,레스토랑,92.56m²,,2021-07-01,110,수원 럭셔리 레스토랑,"연락처공개, 주소공개, 현장사진",저렴하게 급매합니다.,,"3,000만",200만,1억,협상가능,직거래
533517,54-5745,경기남부 평택시 비전동,5층,레스토랑,199m²,,2021-07-08,146,평택 레스토랑 최저권리금 매매!,"연락처공개, 주소공개, 현장사진",부동산문의 교환및문의 절대사절입니다!,,"3,000만",250만,"5,000만",협상가능,직거래
532630,54-4859,서울시 강북구 번동,1층,레스토랑,49.59m²,,2021-06-24,135,수유역 레스토랑,"연락처공개, 주소공개, 현장동영상, 현장사진",문자로 먼저 상담 문의 주세요,,"2,000만",105만,"7,500만",협상가능,직거래
532475,54-4705,경기남부 부천시 옥길동,2층,레스토랑,231.41m²,,2021-04-19,91,부천 옥길 프랜차이즈 레스토랑 양도,"연락처공개, 주소공개, 현장동영상, 현장사진",언제든지 연락주세요,,"5,000만",500만,3억,협상가능,직거래
532151,54-4382,서울시 강서구 화곡동,1층,레스토랑,59.12m²,,2021-06-23,213,화곡동 유명 맛집 양도&양수!!,"연락처공개, 주소공개, 현장사진","기술, 레시피 전수 가능!",,"3,000만",160만,"5,000만",협상가능,직거래
532112,54-4343,서울시 성동구 행당동,4층,레스토랑,62.81m²,경성함바그,2021-04-20,214,유동인구 최상! 왕십리역사 함바그 매장!,"프랜차이즈, 연락처공개, 주소공개, 현장동영상, 현장사진",부동산문의 교환및문의 절대사절입니다.,,"1억5,000만",660만,"8,000만",협상가능,직거래
532084,54-4315,서울시 마포구 도화동,1층,레스토랑,45.29m²,,2021-06-17,106,매출 좋은 매장 기술전수까지 통으로!,"연락처공개, 주소공개, 현장동영상, 현장사진",부동산문의 교환및문의 절대사절입니다.,,"3,000만",240만,3억,협상가능,직거래
531921,54-4152,서울시 종로구 동숭동,2층,레스토랑,235.37m²,,2021-04-12,125,대학로에 유명한 이탈리아음식 임대합니다,"연락처공개, 주소공개, 현장동영상, 현장사진",이탈리아 음식 임대-농림축산식품부 안심식당,,"8,000만",600만,"3억7,000만",협상가능,직거래
531720,54-3951,경기남부 화성시 남양읍 남양리,1층,레스토랑,149m²,,2021-06-10,135,향남에 위치한 독채같은 고급레스토랑,"연락처공개, 주소공개, 현장동영상, 현장사진",***부동산 교환문의 사절합니다.***,,"3,000만",250만,1억,협상가능,직거래
531404,54-3635,경기남부 김포시 고촌읍 전호리,4층,레스토랑,125.62m²,,2021-07-05,81,김포]특수상권 음식점 임대료 16프로,"연락처공개, 주소공개, 현장동영상, 현장사진",양도양수 @  미니멈없는 임대로 16프로,,0만,480만,"1억5,000만",협상가능,직거래
531366,54-3597,경기남부 군포시 산본동,2층,레스토랑,59.07m²,,2021-07-05,455,산본 분위기 좋은 파스타 맛집!!,"연락처공개, 주소공개, 현장사진","대단지 주거상권, 넓은 테라스!",,"2,000만",131만,"1,500만",협상가능,직거래
531273,54-3504,서울시 강남구 역삼동,2층,레스토랑,132.2m²,,2021-04-05,227,강남) 지금아니면 이가격 힘듭니다,"연락처공개, 주소공개, 현장사진",투자대비수익성매장입니다.,,"7,000만",420만,"7,000만",협상가능,직거래
531066,54-3297,서울시 서초구 방배동,1층,레스토랑,82.65m²,,2021-06-07,235,방배역 레스토랑,"연락처공개, 주소공개, 현장동영상, 현장사진",문자로 먼저 상담 문의 주세요,,"3,000만",260만,"6,500만",협상가능,직거래
530279,54-2511,서울시 성동구 행당동,1층,레스토랑,33.06m²,,2021-06-21,211,왕십리역과 한양대 사이의 고급 파스타 맛집,"연락처공개, 주소공개, 현장동영상, 현장사진","2, 5호선과 경의중앙, 수인분당선 총 4개 라인과 한양대 상권",,"2,000만",170만,"8,000만",협상가능,직거래
529855,54-2087,서울시 동대문구 이문동,-1층,레스토랑,42.98m²,,2021-06-21,152,동대문구 이문동 레스토랑,"연락처공개, 주소공개, 현장동영상, 현장사진",문자로 먼저 상담 문의 주세요,,"3,000만",150만,"3,500만",협상가능,직거래
529780,54-2012,서울시 마포구 연남동,2층,레스토랑,78.4m²,,2021-06-16,276,마포구 연남동 레스토랑,"연락처공개, 주소공개, 현장사진",문자로 먼저 상담 문의 주세요,,"3,000만",350만,"5,500만",협상가능,직거래
529237,54-1470,서울시 마포구 상암동,2층,레스토랑,111.41m²,,2021-06-16,160,[상암동] 분위기좋은 식당,"연락처공개, 주소공개, 현장동영상, 현장사진","양식, 와인 전문점",,"3,000만",250만,"7,000만",협상가능,직거래
527867,54-0102,경기남부 시흥시 은행동,2층,레스토랑,87.78m²,,2021-04-15,195,[시흥 은계지구] 프리미엄레스토랑 어반파스타,"연락처공개, 주소공개, 현장동영상, 현장사진",교환문의 사절합니다.,,"3,000만",225만,"3,500만",협상가능,직거래
527054,53-9290,경기남부 용인시 기흥구 보정동,1층,레스토랑,152.07m²,,2021-04-19,196,용인 보정동 이탈리안 음식 레스토랑,"연락처공개, 주소공개, 현장사진",인테리어 시설투자 많이된 독특한 컨셉의 레스토랑,,1억,400만,1억,협상가능,직거래
526980,53-9217,서울시 송파구 방이동,2층,레스토랑,320.25m²,,2021-07-01,222,코벤트 가든 올림픽 공원점,"연락처공개, 주소공개, 현장동영상, 현장사진",올림픽 공원역 방이역 사이 위치,,"2억7,000만",650만,3억,협상가능,직거래
526847,53-9084,서울시 마포구 서교동,1층,레스토랑,135.54m²,,2021-06-28,202,홍대 유명 레스토랑,"연락처공개, 주소공개, 현장동영상, 현장사진",문자로 먼저 상담 문의 주세요,,1억,400만,"1억3,000만",협상가능,직거래
541249,55-3437,인천시 연수구 송도동,4층,레스토랑,761.45m²,마루샤브,2021-07-01,333,이매물이 최고죠! 송도 마루샤브 매매합니다,"프랜차이즈, 현장사진",송도중심상업지역 골든블록내 최고의 입지조건!,이매물이 최고죠! 송도 마루샤브 매매합니다,"7,000만",655만,"4억5,000만",협상가능,중개거래
541355,55-3543,경기북부 남양주시 다산동,2층,레스토랑,79.34m²,정씨함박,2021-06-30,836,다산 초중심상권 프랜차이즈 정씨함박,"프랜차이즈, 연락처공개, 주소공개, 현장동영상, 현장사진","입지, 상권, 유동인구 등 직접 확인하세요","수제함박 패티와 모든 소스를 매일 아침 신선한 재료로 직접 만드는 정씨함박

","4,000만",240만,"9,500만",협상가능,직거래
540218,55-2409,서울시 서대문구 홍제동,1층,레스토랑,66.12m²,,2021-06-30,438,세상에 이런 돈까스매장은 없었다!!,"연락처공개, 주소공개, 현장동영상, 현장사진",홍제역 인스타 맛집!! 랭킹 1위~~~,월 평균 매출 3000만원 초중반 / 월 순이익 1150만원 투명하게 매출 공개 가능합니다. 직접 확인하세요.,"1,500만",120만,"8,500만",협상가능,직거래
539658,55-1854,경기남부 김포시 장기동,2층,레스토랑,234.49m²,서가앤쿡,2021-06-30,328,((서가앤쿡)) 풀오토매장! 순수익 굿!,"프랜차이즈, 현장동영상, 현장사진",관리만 좀 하시고  안정적으로  수익 가져가세요,"풀오토로도 순수익   쏠쏠!
직접 운영시 매출과  수익은  껑충!!
빠르게 문의주세요  !!!","1억2,500만",630만,"2억7,000만",협상가능,중개거래
541598,55-3786,경기남부 화성시 반송동,1층,레스토랑,264.46m²,서가앤쿡,2021-06-30,226,{초특급/초저가}서가앤쿡 동탄점 매매!!!,"프랜차이즈, 연락처공개, 주소공개, 현장동영상, 현장사진",[월 순수익 1천만원]권리금 5천만원에 나왔습니다!!,"최고 항아리 상권인 동탄 파라곤 주상복합단지 1층 상가내에 입점해 동탄신도시에서 맛집으로 유명하며, 확실한 ...",1억,718만,"5,000만",협상가능,직거래
538172,55-0369,서울시 영등포구 문래동2가,1층,레스토랑,332m²,,2021-04-14,437,문래동 창작촌 방송출현 맛집1층 레스토랑,"연락처공개, 현장동영상, 현장사진",방송출현 맛집 레스토랑 / 기본매출5천만원 / 인기몰이 최상,문래동 기본매출 5천 현재 핫플레이스 방송출현 인기몰이 1층 레스토랑,"3,000만",355만,3억,협상가능,직거래
545022,55-7203,경기남부 성남시 분당구 구미동,1층,레스토랑,36.36m²,,2021-07-08,11,미금역바로앞 모두 인정한 맛집 [낭만파스타],"연락처공개, 주소공개, 현장동영상, 현장사진",2001아울렛 바로옆!! 엠코헤리츠 1층~최고위치!,잘부탁드립니다,"3,000만",280만,"5,000만",협상가능,직거래
526045,53-8283,경기남부 화성시 반송동,2층,레스토랑,467.1m²,,2021-06-21,322,{특급}동탄 샤브샤브&뷔페식 샐러드바 매매,"연락처공개, 주소공개, 현장사진",이렇게 좋은 기회는 없습니다. 권리금 헙의가능. 영업중입니다.,,1억,650만,"4,000만",협상가능,직거래
537600,54-9800,경기남부 화성시 반송동,1층,레스토랑,149.15m²,,2021-06-30,5,((동탄))유명 쉐프의 유명 식당!!,"주소공개, 현장동영상",동탄 데이트명소!! 소개팅 명소!!,,"2,000만",160만,"5,000만",협상가능,중개거래
536839,54-9042,서울시 종로구 계동,-1층,레스토랑,99.17m²,,2021-07-01,116,종로 인스타 대박맛집 호랑이카레,"주소공개, 현장동영상, 현장사진",지금 놓치면 후회합니다.,,"1,000만",100만,"8,500만",협상가능,중개거래
