id,code,loc,floor,cate,space,franch,date,hits,title,marks,subtitle,copy,deposit,mthfee,prem,nego_ok,regist
541901,55-4089,경기남부 광주시 경안동,1층,기타판매점,599.56m²,,2021-06-30,324,[광주/경안동]투자수익률높은대로변빌딩특급매매,현장사진,"높은 수익률에 입지좋은 대로변 빌딩이 나왔습니다(매매,임대가능)",[광주/경안동]투자수익률높은대로변빌딩특급매매,0만,없음,"39억5,000만",협상가능,중개거래
542558,55-4744,경기남부 시흥시 대야동,1층,기타판매점,49.59m²,진이찬방,2021-07-06,368,[섹시한매장]오픈3개월 진이찬방 매출상승중,"프랜차이즈, 연락처공개, 주소공개, 현장동영상, 현장사진",매출1900 이상  순수익 600~700,"매출1800
대한민국1등 진이찬방
오픈3개월차
","3,000만",220만,"6,900만",협상가능,직거래
541960,55-4148,서울시 동대문구 장안동,2층,기타판매점,258.18m²,,2021-06-30,262,"[동대문구]월평균 매출 1억이상,캠핑트렁크",현장사진,최고 매출2억 이상 발생하는 캠핑전문 멀티샵이 나왔습니다.,"[동대문구]월평균 매출 1억이상,캠핑트렁크","5,000만",330만,"1억8,000만",협상가능,중개거래
538440,55-0636,강원도 강릉시 성남동,1층,기타판매점,66.12m²,,2021-06-30,293,[주목] 큰 사거리 + 대로변 + 코너 자리,"연락처공개, 현장동영상, 현장사진",[ 성업중 ] 방문전 전화로 예약 하신 후，방문해 주세요,지금 바로 전화 주세요 !!!,"5,000만",200만,"5,000만",협상가능,직거래
538193,55-0390,서울시 강서구 화곡동,1층,기타판매점,76.03m²,,2021-06-30,429,화곡 우장산역 초역세권 알짜배기 자리,"연락처공개, 주소공개",상권 내 유동인구 집중골목 위치 사거리 코너 자리,연락주세요,1억,770만,"4,000만",협상가능,직거래
544784,55-6965,서울시 은평구 진관동,1층,기타판매점,65.581m²,,2021-06-25,18,((은평구)) 매출 좋은 정육점,"주소공개, 현장사진",저렴하게  나왔습니다.,"은평구 단골 확실히 잡힌 정육점!!
수산과 청과 병행 가능합니다
빠르게 문의주세요~~!!","3,000만",180만,"6,000만",협상가능,중개거래
543124,55-5309,서울시 구로구 가리봉동,1층,기타판매점,26.45m²,,2021-06-11,183,"강력추천 편의점자리,슈퍼","연락처공개, 주소공개, 현장사진",가리봉동 메인1층중국식품 마트입니다,"가리봉시장 메인 중국식품 판매점
강력추천 편의점자리 마트자리","2,000만",160만,"7,000만",협상가능,직거래
542301,55-4488,경기북부 남양주시 별내동,1층,기타판매점,29.75m²,,2021-07-07,83,별내 상업지구 무인 성인용품 매장,"연락처공개, 주소공개, 현장사진",오토 운영중(수익 150이상~~~),완전 대박 매장,"2,000만",120만,"5,000만",협상가능,직거래
528591,54-0825,경기남부 김포시 구래동,1층,기타판매점,52.89m²,,2021-07-06,1907,구래동 섹시한 무인빨래방 컨디션최고!!,"연락처공개, 주소공개, 현장동영상, 현장사진",운영쉬운 무인빨래방 매출상승중 저렴한월세,"구래동 섹시한 무인빨래방
정말쉬운 운영방법
고정수익","2,000만",150만,"8,000만",협상가능,직거래
523914,53-6152,경기북부 고양시 일산서구 주엽동,-01층,기타판매점,33.06m²,,2021-07-06,487,[일산 그랜드백화점]월 수익률 700 이상,현장사진,평생 리스크 없이 운영할 수 있는 사업/수익률 매장/안정적인 사,그랜드 두부,0만,없음,"8,000만",협상가능,중개거래
541226,55-3415,인천시 부평구 부평동,1층,기타판매점,125m²,,2021-07-06,152,(부평) 무인빨래방 창업 무인시스템 24시간,"연락처공개, 주소공개, 현장사진",블루워시 셀프빨래방 간편운영 가능 아이템!,010-7516-2211,"4,000만",205만,"1억2,000만",협상가능,직거래
540924,55-3113,인천시 남동구 논현동,1층,기타판매점,29.97m²,,2021-07-06,266,인천 무인성인용품샵 !!  얘들은 가라~~,"연락처공개, 주소공개, 현장동영상, 현장사진",코로나 타파 !! 무인이 답이다 !! 월세도 저렴합니다.,소래포구역 역세권에 위치한 프랜차이즈 무인성인샵,"1,000만",80만,"6,900만",협상가능,직거래
526340,53-8577,서울시 마포구 상암동,-1층,기타판매점,40.18m²,,2021-06-21,1978,빨래방! 오토로 돌아가는 셀프 무인 세탁소,"연락처공개, 주소공개, 현장동영상, 현장사진",코로나 영향없는 무인 빨래방,,"2,000만",180만,"7,000만",협상가능,직거래
544832,55-7013,경기남부 평택시 안중읍 안중리,1층,기타판매점,59.5m²,,2021-07-07,12,[평택시 안중읍]로드 정육점!!,"연락처공개, 주소공개, 현장사진",입지 좋음!,,"2,000만",140만,"8,000만",협상가능,직거래
544547,55-6729,경기남부 군포시 산본동,1층,기타판매점,24.79m²,,2021-07-04,23,군포시 무인 아이스크림 할인점 매장 양도,"연락처공개, 주소공개, 현장동영상, 현장사진",경기남부 군포시에 위치한 무인 아이스크림 할인점 매장,,"1,000만",90만,"2,800만",협상가능,직거래
544492,55-6674,경기남부 용인시 수지구 상현동,1층,기타판매점,46.28m²,,2021-07-02,17,[용인시 상현동]1인 로드샵 정육점!!,"연락처공개, 주소공개, 현장사진",입지 좋음!,,"3,000만",190만,"2,300만",협상가능,직거래
544418,55-6600,서울시 마포구 창전동,1층,기타판매점,29.75m²,,2021-07-01,11,마포구 창전동 플라워샵,"연락처공개, 주소공개, 현장동영상, 현장사진",부동산 교환 권유 전화 엄금!,,"1,500만",75만,"2,000만",협상가능,직거래
544388,55-6570,경기북부 양주시 광사동,1층,기타판매점,561.99m²,,2021-07-01,2,중고 가전 센타,"연락처공개, 주소공개, 현장사진",물건 1억 5천만원 어치 보유,,"1,500만",125만,1억,협상가능,직거래
544357,55-6539,서울시 성동구 성수동2가,1층,기타판매점,39.67m²,,2021-06-30,16,성동구 성수동 바이크매장,"연락처공개, 주소공개, 현장동영상, 현장사진",부동산 교환 권유 전화 엄금!,,"2,000만",180만,"2,000만",협상가능,직거래
544285,55-6467,경기남부 의왕시 삼동,1층,기타판매점,28.76m²,,2021-06-30,10,의왕시 무인아이스크림 매장 양도,"연락처공개, 주소공개, 현장동영상, 현장사진",경기남부 의왕시에 위치한 무인아이스크림 매장,,"1,000만",120만,"3,520만",협상가능,직거래
544240,55-6423,경기남부 수원시 영통구 영통동,3층,기타판매점,158m²,,2021-06-29,39,수원 영통 성인용품점,"연락처공개, 주소공개, 현장사진",영통 번화가 내 위치한 성인용품샵 입니다,,"2,000만",120만,"9,000만",협상가능,직거래
544209,55-6392,서울시 서대문구 남가좌동,1층,기타판매점,46.28m²,,2021-06-28,23,서대문구 과일가게 매장 양도,"연락처공개, 주소공개, 현장동영상, 현장사진",서울시 서대문구에 위치한 과일가게 매장,,"5,000만",250만,"3,000만",협상가능,직거래
544155,55-6338,경기남부 수원시 권선구 권선동,1층,기타판매점,46.24m²,,2021-06-28,25,수원 자리좋은 1층상가 양도합니다.,"연락처공개, 주소공개, 현장동영상, 현장사진",수원 자리좋은 1층상가 양도합니다.,,"2,000만",140만,"2,000만",협상가능,직거래
544107,55-6290,인천시 연수구 연수동,1층,기타판매점,33.06m²,,2021-06-25,43,인천시 연구구 성인용품 매장,"연락처공개, 주소공개, 현장동영상, 현장사진",부동산 교환 권유 전화 엄금!,,"1,000만",100만,"2,500만",협상가능,직거래
544073,55-6256,경기북부 의정부시 낙양동,1층,기타판매점,28.76m²,,2021-06-25,25,의정부 정육점 매매,"연락처공개, 주소공개, 현장동영상, 현장사진",로드샵 팝니다.,,"2,000만",180만,"4,500만",협상가능,직거래
543822,55-6006,인천시 부평구 부평동,2층,기타판매점,52.89m²,,2021-06-19,40,인천시 부평 무인 성인용품점,"연락처공개, 주소공개, 현장동영상, 현장사진",부동산 교환 권유 전화 엄금!,,"1,000만",100만,"4,500만",협상가능,직거래
543776,55-5960,서울시 강남구 역삼동,-1층,기타판매점,33.06m²,,2021-06-22,24,강남구 역삼동에 위치한 1층 상가,"연락처공개, 주소공개, 현장동영상, 현장사진",베이킹클래스만 전문으로 하는 베이킹스튜디오,,"2,000만",110만,"4,000만",협상가능,직거래
543726,55-5910,경기북부 포천시 소흘읍 송우리,1층,기타판매점,58.08m²,,2021-06-21,17,포천 소흘 국내유일 보석십자수 수재샵,"연락처공개, 주소공개, 현장사진",지금 놓치면 후회합니다.,,"2,000만",110만,"3,500만",협상가능,직거래
543716,55-5900,경기남부 용인시 처인구 남사읍 완장리,1층,기타판매점,46.28m²,,2021-06-21,19,용인 대단지 아파트단지내 과일전문점,"연락처공개, 주소공개, 현장사진",마진이 좋아요,,"2,000만",230만,"8,000만",협상가능,직거래
543662,55-5847,경기북부 양주시 광사동,1층,기타판매점,44.96m²,,2021-06-21,11,광사동 최상의 입지 핸드폰가게,"연락처공개, 주소공개, 현장동영상, 현장사진",위치 짱좋아요,,"5,000만",260만,"2,500만",협상가능,직거래
543483,55-5668,경기북부 양주시 옥정동,1층,기타판매점,49.59m²,,2021-06-17,46,[양주시 옥정동]로드 정육점!!,"연락처공개, 주소공개, 현장동영상, 현장사진",안정적인 매출 / 입지 좋음,,"3,000만",250만,"1,500만",협상가능,직거래
543412,55-5597,서울시 양천구 목동,-2층,기타판매점,46.28m²,,2021-06-16,32,오목교역안 초특급물건 대박어묵집,"연락처공개, 주소공개, 현장동영상, 현장사진",부동산 맞교환 절대사절,,"4,800만",800만,"4,700만",협상가능,직거래
543238,55-5423,서울시 구로구 궁동,1층,기타판매점,23.14m²,,2021-06-14,32,온수역 역세권 특급자리,"연락처공개, 주소공개, 현장동영상, 현장사진",부동산 맞교환 절대 사절,,"1,500만",70만,500만,협상가능,직거래
543204,55-5389,서울시 영등포구 신길동,1층,기타판매점,62.81m²,,2021-06-14,78,[영등포구 신길동]주5일 한우정육점!!,"연락처공개, 주소공개, 현장사진",입지 좋음!,,"1,000만",100만,"2,300만",협상가능,직거래
543152,55-5337,서울시 중랑구 면목동,1층,기타판매점,33.06m²,,2021-06-11,49,중랑구 전통시장 내 점포,"연락처공개, 주소공개, 현장동영상, 현장사진",부동산 교환권유 전화 금지!,,"3,000만",130만,"2,000만",협상가능,직거래
543149,55-5334,경기남부 시흥시 신천동,1층,기타판매점,57m²,,2021-06-13,10,먹자라인 번화가 사거리 휴대폰매장,"연락처공개, 주소공개, 현장사진",부동산 교환 사절,,"3,000만",300만,"5,000만",협상가능,직거래
543037,55-5222,경기북부 고양시 일산동구 백석동,-1층,기타판매점,23.14m²,,2021-06-10,31,동궁스파24 실내매점,"연락처공개, 주소공개, 현장사진",일산의 명소/ 스파/ 실내매점,,1억,150만,없음,,직거래
543033,55-5218,경기북부 고양시 덕양구 신원동,1층,기타판매점,33.06m²,,2021-06-10,56,[고양시 신원동]1층 공원 옆 무권리상가!!,"연락처공개, 주소공개, 현장사진",입지 좋음!,,"1,000만",80만,없음,,직거래
543024,55-5209,경기남부 용인시 수지구 상현동,1층,기타판매점,76.87m²,,2021-06-10,21,[특급]용인 광교상현동 반찬가게 매매!!!,"연락처공개, 주소공개, 현장동영상, 현장사진",활발히 영업중입니다.,,"2,000만",170만,"9,000만",협상가능,직거래
542800,55-4985,인천시 남동구 구월동,1층,기타판매점,42.8m²,,2021-06-07,30,인천 남동구 구월동 반려동물용품 매장,"연락처공개, 주소공개, 현장동영상, 현장사진",기본 인테리어 및 붙박이 시설만 양도하는 조건입니다.,,"1,000만",80만,"1,000만",협상가능,직거래
542798,55-4983,인천시 연수구 송도동,1층,기타판매점,29.75m²,,2021-07-08,39,[연수구 송도동]로드샵 정육점!!,"연락처공개, 주소공개, 현장사진",입지 좋음!,,"4,000만",270만,"6,800만",협상가능,직거래
542755,55-4940,경기북부 고양시 덕양구 삼송동,1층,기타판매점,52.89m²,,2021-06-06,25,고양시 삼송동 목좋은 과일가게,"연락처공개, 주소공개, 현장동영상, 현장사진",개업하니 7월 채 안됐습니다.,,"3,000만",170만,"3,500만",협상가능,직거래
542507,55-4694,인천시 서구 신현동,1층,기타판매점,79.34m²,,2021-06-02,26,[인천시 서구]로드매장 - 정육점!!,"연락처공개, 주소공개, 현장사진",입지 좋음!,,"2,500만",140만,1억,협상가능,직거래
542505,55-4692,경기북부 양주시 백석읍 복지리,1층,기타판매점,165.29m²,,2021-06-02,40,[경기북부 양주시]자금문제로 정육점 양도!!,"연락처공개, 주소공개, 현장사진",안정적인 매출!,,"4,000만",260만,"4,500만",협상가능,직거래
542438,55-4625,경기남부 화성시 진안동,1층,기타판매점,59.5m²,,2021-06-01,56,화성시 중심상가 메인 거리 매장,"연락처공개, 주소공개, 현장동영상, 현장사진","네일아트, 헤어샵, 의류, 공방, 카페 추천합니다.",,"2,000만",100만,없음,,직거래
542427,55-4614,서울시 도봉구 창동,1층,기타판매점,44.63m²,,2021-07-02,37,창동 아이파크 앞 귀금속 전문점,"연락처공개, 주소공개, 현장동영상, 현장사진",귀금속 아니더라도 타업종도 인테리어 되어있어 좋아용,,"1,386만",139만,"3,000만",협상가능,직거래
542402,55-4589,경기남부 성남시 분당구 수내동,-1층,기타판매점,439.67m²,,2021-07-02,32,"분당 애견호텔, 놀이방 매장 매매합니다.","연락처공개, 주소공개, 현장사진",15년이상 영업하고 있으며 초역세권으로 탄탄한 고객층을 보유,,"5,400만",500만,"1억3,000만",협상가능,직거래
542276,55-4463,경기북부 남양주시 진건읍 용정리,1층,기타판매점,33.06m²,,2021-05-31,33,남양주 판매시설,"연락처공개, 주소공개, 현장사진",현재 컴퓨터 판매수리점,,"1,500만",70만,"2,000만",협상가능,직거래
541760,55-3948,서울시 은평구 역촌동,1층,기타판매점,34.38m²,,2021-05-24,66,은평구 역촌 1인 운영가능한 애견샵,"연락처공개, 주소공개, 현장사진",초보운영가능 몸만들어와서 운영가능,,"1,000만",80만,"1,200만",협상가능,직거래
541408,55-3596,경기북부 고양시 일산동구 정발산동,1층,기타판매점,42.31m²,,2021-05-20,57,일산 밤리단길 수제애견간식전문점,"연락처공개, 주소공개, 현장사진",일산에서 가장 뜨고있는 곳에서 저렴하게 시작해보세요.,,"1,000만",75만,"4,000만",협상가능,직거래
541381,55-3569,경기남부 김포시 구래동,1층,기타판매점,46.28m²,,2021-05-18,22,김포시 구래동 휴대폰케이스 매장,"연락처공개, 주소공개, 현장동영상, 현장사진",부동산 교환권유 전화 금지!,,"3,000만",270만,"3,500만",협상가능,직거래
541210,55-3399,경기남부 용인시 수지구 죽전동,1층,기타판매점,36.36m²,,2021-06-17,24,상권좋은 수지 죽전동 프랜차이즈 반찬점,"연락처공개, 주소공개, 현장사진",초보자도 운영가능한 프리미엄 반찬점,,"3,000만",120만,1억,협상가능,직거래
540951,55-3140,경기남부 여주시 현암동,1층,기타판매점,59.5m²,,2021-06-14,47,경기여주 크린토피아 양도양수,"연락처공개, 주소공개, 현장사진",안정적 업종,,"1,500만",70만,"5,000만",협상가능,직거래
540724,55-2913,서울시 광진구 화양동,2층,기타판매점,56.2m²,,2021-05-12,20,건대입구 화양동 채광좋고 예쁜 매장,"연락처공개, 주소공개, 현장동영상, 현장사진",건대 카페와 유명한 맛집이 많은 라인,,"2,000만",145만,"5,000만",협상가능,직거래
539305,55-1501,경기남부 부천시 원종동,1층,기타판매점,39.67m²,,2021-04-28,148,[경기남부 부천시]종합시장내 정육점!!,"연락처공개, 주소공개, 현장사진",입지 좋음!,,"3,000만",168만,"2,500만",협상가능,직거래
539024,55-1220,서울시 강남구 논현동,-1층,기타판매점,122.31m²,,2021-05-27,63,(논현동) 열대어 판매 및 수족관 매매,"연락처공개, 주소공개, 현장사진",강남에서 월세 내면서 6년동안 운영해온 매장,,"2,000만",160만,"2,500만",협상가능,직거래
538984,55-1180,서울시 도봉구 창동,1층,기타판매점,132.23m²,,2021-04-25,88,### 창동역 인근 정육점 ###,"연락처공개, 주소공개, 현장사진",정육점이나 정육식당 추천합니다,,"5,000만",250만,"6,000만",협상가능,직거래
538943,55-1139,경기남부 용인시 수지구 신봉동,1층,기타판매점,59.5m²,,2021-04-24,49,용인시 수지구 신봉동 골프샵(타업종 가능),"연락처공개, 주소공개, 현장사진",부동산 교환권유 전화금지!,,"1,000만",80만,"2,000만",협상가능,직거래
538765,55-0961,경기북부 양주시 백석읍 오산리,1층,기타판매점,99.17m²,,2021-04-22,30,[경기북부 양주시 백석읍]로드 정육매장!!,"연락처공개, 주소공개, 현장사진",입지 좋음!,,"1,500만",130만,"6,800만",협상가능,직거래
538718,55-0914,경기남부 성남시 수정구 창곡동,1층,기타판매점,51.87m²,,2021-06-24,58,위례 순수익 800 이상 반찬가게 매장!,"연락처공개, 주소공개, 현장사진","1,137세대 아파트 입구 앞! 교환문의 사절!",,"8,000만",330만,"6,500만",협상가능,직거래
538615,55-0811,서울시 종로구 종로6가,1층,기타판매점,49.6m²,,2021-04-20,49,종로6가 꽃집,"연락처공개, 주소공개, 현장사진",[교환사절] 문자로 먼저 상담 문의 주세요,,"1,500만",125만,"8,000만",협상가능,직거래
538528,55-0724,서울시 종로구 종로3가,1층,기타판매점,29.75m²,,2021-04-19,29,종로3가 1층 상가,"연락처공개, 주소공개, 현장사진",[교환사절] 문자로 먼저 상담 문의 주세요,,"1,000만",180만,"6,000만",협상가능,직거래
538457,55-0653,인천시 서구 청라동,2층,기타판매점,57m²,,2021-06-24,71,##청라동 전자담배,"연락처공개, 주소공개, 현장동영상, 현장사진",부동산 맞교환등 일체 사절합니다,,"1,000만",80만,"1,500만",협상가능,직거래
538455,55-0651,경기남부 부천시 소사본동,1층,기타판매점,26.45m²,,2021-06-21,281,(부천시) 소사본동 로또판매 매장,"연락처공개, 주소공개, 현장동영상, 현장사진",복권판매점은 현재 판매점이시거나 신규 판매점 가능,,"2,500만",120만,"1,500만",협상가능,직거래
538448,55-0644,서울시 은평구 대조동,1층,기타판매점,49m²,,2021-04-19,28,##젓갈40년 두부제조20년,"연락처공개, 주소공개, 현장사진",부동산 맞교환등 일체 사절합니다,,"2,000만",70만,"8,000만",협상가능,직거래
538201,55-0398,경기남부 성남시 중원구 도촌동,1층,기타판매점,52.89m²,,2021-04-13,79,[경기남부 성남시 중원구] 로드 정육점!!,"연락처공개, 주소공개, 현장동영상, 현장사진",입지 좋음!,,"3,000만",230만,"2,500만",협상가능,직거래
538061,55-0258,서울시 영등포구 신길동,1층,기타판매점,26.45m²,,2021-04-14,77,### 영등포 신길동 대로변 신발가게 ###,"연락처공개, 주소공개, 현장동영상, 현장사진",유동인구 많습니다,,"1,300만",140만,"2,000만",협상가능,직거래
537927,55-0126,경기남부 수원시 권선구 권선동,1층,기타판매점,69.42m²,,2021-04-12,49,[경기남부 수원시]로드샵 정육매장!!,"연락처공개, 주소공개, 현장사진",입지 좋음!,,"3,000만",110만,"2,500만",협상가능,직거래
541901,55-4089,경기남부 광주시 경안동,1층,기타판매점,599.56m²,,2021-06-30,324,[광주/경안동]투자수익률높은대로변빌딩특급매매,현장사진,"높은 수익률에 입지좋은 대로변 빌딩이 나왔습니다(매매,임대가능)",[광주/경안동]투자수익률높은대로변빌딩특급매매,0만,없음,"39억5,000만",협상가능,중개거래
542558,55-4744,경기남부 시흥시 대야동,1층,기타판매점,49.59m²,진이찬방,2021-07-06,368,[섹시한매장]오픈3개월 진이찬방 매출상승중,"프랜차이즈, 연락처공개, 주소공개, 현장동영상, 현장사진",매출1900 이상  순수익 600~700,"매출1800
대한민국1등 진이찬방
오픈3개월차
","3,000만",220만,"6,900만",협상가능,직거래
541960,55-4148,서울시 동대문구 장안동,2층,기타판매점,258.18m²,,2021-06-30,262,"[동대문구]월평균 매출 1억이상,캠핑트렁크",현장사진,최고 매출2억 이상 발생하는 캠핑전문 멀티샵이 나왔습니다.,"[동대문구]월평균 매출 1억이상,캠핑트렁크","5,000만",330만,"1억8,000만",협상가능,중개거래
538440,55-0636,강원도 강릉시 성남동,1층,기타판매점,66.12m²,,2021-06-30,293,[주목] 큰 사거리 + 대로변 + 코너 자리,"연락처공개, 현장동영상, 현장사진",[ 성업중 ] 방문전 전화로 예약 하신 후，방문해 주세요,지금 바로 전화 주세요 !!!,"5,000만",200만,"5,000만",협상가능,직거래
538193,55-0390,서울시 강서구 화곡동,1층,기타판매점,76.03m²,,2021-06-30,429,화곡 우장산역 초역세권 알짜배기 자리,"연락처공개, 주소공개",상권 내 유동인구 집중골목 위치 사거리 코너 자리,연락주세요,1억,770만,"4,000만",협상가능,직거래
544784,55-6965,서울시 은평구 진관동,1층,기타판매점,65.581m²,,2021-06-25,18,((은평구)) 매출 좋은 정육점,"주소공개, 현장사진",저렴하게  나왔습니다.,"은평구 단골 확실히 잡힌 정육점!!
수산과 청과 병행 가능합니다
빠르게 문의주세요~~!!","3,000만",180만,"6,000만",협상가능,중개거래
543124,55-5309,서울시 구로구 가리봉동,1층,기타판매점,26.45m²,,2021-06-11,183,"강력추천 편의점자리,슈퍼","연락처공개, 주소공개, 현장사진",가리봉동 메인1층중국식품 마트입니다,"가리봉시장 메인 중국식품 판매점
강력추천 편의점자리 마트자리","2,000만",160만,"7,000만",협상가능,직거래
542301,55-4488,경기북부 남양주시 별내동,1층,기타판매점,29.75m²,,2021-07-07,83,별내 상업지구 무인 성인용품 매장,"연락처공개, 주소공개, 현장사진",오토 운영중(수익 150이상~~~),완전 대박 매장,"2,000만",120만,"5,000만",협상가능,직거래
537898,55-0097,서울시 노원구 상계동,1층,기타판매점,36.36m²,,2021-04-12,169,### 마들역세권 정육점 ###,"연락처공개, 주소공개, 현장사진",유동인구 많습니다,,"3,000만",130만,500만,협상가능,직거래
537822,55-0022,서울시 구로구 오류동,1층,기타판매점,28.1m²,,2021-04-11,47,### 구로구 오류동소재 생선가게 ###,"연락처공개, 주소공개, 현장동영상, 현장사진",단골손님 많습니다,,"2,000만",120만,"4,000만",협상가능,직거래
537813,55-0013,인천시 부평구 부평동,-2층,기타판매점,10.36m²,,2021-04-09,73,인천 소자본 창업 아이템 매장 양도,"연락처공개, 주소공개, 현장동영상, 현장사진","스마트폰 사진으로 메탈액자, 액세서리 제작 매장",,"2,000만",160만,"1,500만",협상가능,직거래
537775,54-9975,경기북부 동두천시 생연동,1층,기타판매점,115.04m²,,2021-04-09,45,### 동두천시 중앙로 화원 ###,"연락처공개, 주소공개, 현장사진",검증된 자리입니다,,"5,000만",110만,"1,000만",협상가능,직거래
537557,54-9757,서울시 마포구 연남동,1층,기타판매점,23.14m²,,2021-04-04,63,마포구 연남동 악세사리 판매점,"연락처공개, 주소공개, 현장동영상, 현장사진",부동산 교환권유 전화금지!,,"1,000만",160만,"5,000만",협상가능,직거래
537174,54-9376,서울시 은평구 갈현동,1층,기타판매점,33m²,,2021-07-05,121,##마트내 정육점,"연락처공개, 주소공개, 현장사진",부동산 맞교환등 일체 사절합니다,,"1,500만",100만,100만,협상가능,직거래
536891,54-9094,경기북부 남양주시 별내동,1층,기타판매점,59.5m²,,2021-07-05,58,별내 로데오거리 반찬 매장 양도,"연락처공개, 주소공개, 현장동영상, 현장사진",남양주 반찬 맛집으로 인기 있는 매장,,"4,500만",300만,"7,000만",협상가능,직거래
536642,54-8845,서울시 동작구 사당동,1층,기타판매점,33.06m²,,2021-06-24,69,### 7호선 남성역 인근 반찬가게 ###,"연락처공개, 주소공개, 현장사진",단골손님 많습니다,,"1,300만",190만,"8,700만",협상가능,직거래
535165,54-7390,서울시 송파구 삼전동,1층,기타판매점,32.4m²,,2021-07-01,261,[송파구] 역세권 카페같이 예쁜 꽃집 매장,"연락처공개, 주소공개, 현장사진",교환사절/ 접근성 입지성 매우 우수,,"2,000만",110만,"2,300만",협상가능,직거래
535001,54-7227,서울시 강남구 신사동,1층,기타판매점,98.84m²,,2021-06-24,121,### 신사역 도보5분 생닭유통대리점 ###,"연락처공개, 주소공개, 현장사진",거래처 많습니다,,"1,500만",240만,"2,500만",협상가능,직거래
